KODE_KAB,KABUPATEN,JENJANG_PENDIDIKAN,PCT_BERAT
9435,"Kab. Intan Jaya, Papua",Jenjang Pendidikan SMA,50
9430,"Kab. Lanny Jaya, Papua",Jenjang Pendidikan SMA,47.3684
1172,"Kota Sabang, Aceh",Jenjang Pendidikan SMA,40.9091
1225,"Kab. Nias Barat, Sumatera Utara",Jenjang Pendidikan SMA,38.7931
1175,"Kota Subulussalam, Aceh",Jenjang Pendidikan SMA,29.5238
7412,"Kab. Konawe Kepulauan, Sulawesi Tenggara",Jenjang Pendidikan SMA,26.5306
9434,"Kab. Dogiyai, Papua",Jenjang Pendidikan SMA,22.2222
1807,"Kab. Way Kanan, Lampung",Jenjang Pendidikan SMA,21.4076
1224,"Kab. Nias Utara, Sumatera Utara",Jenjang Pendidikan SMA,20.3704
9108,"Kab. Raja Ampat, Papua Barat",Jenjang Pendidikan SMA,20
1101,"Kab. Simeulue, Aceh",Jenjang Pendidikan SMA,18.4713
5321,"Kab. Malaka, Nusa Tenggara Timur",Jenjang Pendidikan SMA,17.619
1116,"Kab. Aceh Jaya, Aceh",Jenjang Pendidikan SMA,17.5258
7209,"Kab. Tojo Una-Una, Sulawesi Tengah",Jenjang Pendidikan SMA,17.4312
5304,"Kab. Timor Tengah Selatan, Nusa Tenggara Timur",Jenjang Pendidikan SMA,17.3077
7405,"Kab. Konawe Selatan, Sulawesi Tenggara",Jenjang Pendidikan SMA,16.9381
9431,"Kab. Membramo Tengah, Papua",Jenjang Pendidikan SMA,16.6667
1204,"Kab. Tapanuli Tengah, Sumatera Utara",Jenjang Pendidikan SMA,16.6667
5317,"Kab. Sumba Barat Daya, Nusa Tenggara Timur",Jenjang Pendidikan SMA,16.4179
1201,"Kab. Nias, Sumatera Utara",Jenjang Pendidikan SMA,15.7895
1111,"Kab. Aceh Utara, Aceh",Jenjang Pendidikan SMA,15.7724
1173,"Kota Langsa, Aceh",Jenjang Pendidikan SMA,15.3374
6107,"Kab. Sintang, Kalimantan Barat",Jenjang Pendidikan SMA,15.1057
5305,"Kab. Timor Tengah Utara, Nusa Tenggara Timur",Jenjang Pendidikan SMA,14.9847
9414,"Kab. Mappi, Papua",Jenjang Pendidikan SMA,14.9254
7403,"Kab. Konawe, Sulawesi Tenggara",Jenjang Pendidikan SMA,14.9007
1214,"Kab. Nias Selatan, Sumatera Utara",Jenjang Pendidikan SMA,14.8936
8204,"Kab. Halmahera Selatan, Maluku Utara",Jenjang Pendidikan SMA,14.1414
1813,"Kab. Pesisir Barat, Lampung",Jenjang Pendidikan SMA,13.5338
3209,"Kab. Cirebon, Jawa Barat",Jenjang Pendidikan SMA,13.4307
7201,"Kab. Banggai Kepulauan, Sulawesi Tengah",Jenjang Pendidikan SMA,13.3858
1403,"Kab. Indragiri Hilir, Riau",Jenjang Pendidikan SMA,13.2432
7471,"Kota Kendari, Sulawesi Tenggara",Jenjang Pendidikan SMA,13.2275
9171,"Kota Sorong, Papua Barat",Jenjang Pendidikan SMA,13.1068
7415,"Kab. Buton Selatan, Sulawesi Tenggara",Jenjang Pendidikan SMA,13.0952
3522,"Kab. Bojonegoro, Jawa Timur",Jenjang Pendidikan SMA,13.0189
5301,"Kab. Sumba Barat, Nusa Tenggara Timur",Jenjang Pendidikan SMA,13.0137
8172,"Kota Tual, Maluku",Jenjang Pendidikan SMA,13.0081
7411,"Kab. Kolaka Timur, Sulawesi Tenggara",Jenjang Pendidikan SMA,12.6126
5313,"Kab. Manggarai, Nusa Tenggara Timur",Jenjang Pendidikan SMA,12.5
5303,"Kab. Kupang, Nusa Tenggara Timur",Jenjang Pendidikan SMA,12.5
8107,"Kab. Seram Bagian Timur, Maluku",Jenjang Pendidikan SMA,12.3288
1104,"Kab. Aceh Tenggara, Aceh",Jenjang Pendidikan SMA,12.3077
1205,"Kab. Tapanuli Utara, Sumatera Utara",Jenjang Pendidikan SMA,11.8919
5312,"Kab. Ngada, Nusa Tenggara Timur",Jenjang Pendidikan SMA,11.8812
6409,"Kab. Penajam Paser Utara, Kalimantan Timur",Jenjang Pendidikan SMA,11.8812
6103,"Kab. Landak, Kalimantan Barat",Jenjang Pendidikan SMA,11.6809
8203,"Kab. Kepulauan Sula, Maluku Utara",Jenjang Pendidikan SMA,11.5385
7413,"Kab. Muna Barat, Sulawesi Tenggara",Jenjang Pendidikan SMA,11.4754
1118,"Kab. Pidie Jaya, Aceh",Jenjang Pendidikan SMA,11.3095
5307,"Kab. Alor, Nusa Tenggara Timur",Jenjang Pendidikan SMA,11.25
7603,"Kab. Mamasa, Sulawesi Barat",Jenjang Pendidikan SMA,11.1888
6310,"Kab. Tanah Bumbu, Kalimantan Selatan",Jenjang Pendidikan SMA,11.1111
9436,"Kab. Deiyai, Papua",Jenjang Pendidikan SMA,11.1111
5315,"Kab. Manggarai Barat, Nusa Tenggara Timur",Jenjang Pendidikan SMA,10.9635
7202,"Kab. Banggai, Sulawesi Tengah",Jenjang Pendidikan SMA,10.8187
1302,"Kab. Pesisir Selatan, Sumatera Barat",Jenjang Pendidikan SMA,10.6178
7402,"Kab. Muna, Sulawesi Tenggara",Jenjang Pendidikan SMA,10.596
5309,"Kab. Flores Timur, Nusa Tenggara Timur",Jenjang Pendidikan SMA,10.5634
9403,"Kota Jayapura, Papua",Jenjang Pendidikan SMA,10.4556
3604,"Kab. Serang, Banten",Jenjang Pendidikan SMA,10.4079
3601,"Kab. Pandeglang, Banten",Jenjang Pendidikan SMA,10.395
5206,"Kab. Bima, Nusa Tenggara Barat",Jenjang Pendidikan SMA,10.2564
1210,"Kab. Dairi, Sumatera Utara",Jenjang Pendidikan SMA,10.231
1507,"Kab. Tanjung Jabung Barat, Jambi",Jenjang Pendidikan SMA,10.2041
3208,"Kab. Kuningan, Jawa Barat",Jenjang Pendidikan SMA,10.1604
7606,"Kab. Mamuju Tengah, Sulawesi Barat",Jenjang Pendidikan SMA,10.0917
1811,"Kab. Mesuji, Lampung",Jenjang Pendidikan SMA,10.0917
9112,"Kab. Pegunungan Arfak, Papua Barat",Jenjang Pendidikan SMA,10
3602,"Kab. Lebak, Banten",Jenjang Pendidikan SMA,9.9831
7312,"Kab. Soppeng, Sulawesi Selatan",Jenjang Pendidikan SMA,9.8522
3527,"Kab. Sampang, Jawa Timur",Jenjang Pendidikan SMA,9.7701
1106,"Kab. Aceh Tengah, Aceh",Jenjang Pendidikan SMA,9.7345
6501,"Kab. Malinau, Kalimantan Utara",Jenjang Pendidikan SMA,9.6154
8207,"Kab. Kepulauan Morotai, Maluku Utara",Jenjang Pendidikan SMA,9.5238
9417,"Kab. Pegunungan Bintang, Papua",Jenjang Pendidikan SMA,9.5238
1604,"Kab. Lahat, Sumatera Selatan",Jenjang Pendidikan SMA,9.5032
7408,"Kab. Kolaka Utara, Sulawesi Tenggara",Jenjang Pendidikan SMA,9.434
8101,"Kab. Maluku Tenggara Barat, Maluku",Jenjang Pendidikan SMA,9.4241
1301,"Kab. Kepulauan Mentawai, Sumatera Barat",Jenjang Pendidikan SMA,9.396
5202,"Kab. Lombok Tengah, Nusa Tenggara Barat",Jenjang Pendidikan SMA,9.3812
6404,"Kab. Kutai Timur, Kalimantan Timur",Jenjang Pendidikan SMA,9.3117
5308,"Kab. Lembata, Nusa Tenggara Timur",Jenjang Pendidikan SMA,9.2857
1502,"Kab. Merangin, Jambi",Jenjang Pendidikan SMA,9.0909
8109,"Kab. Buru Selatan, Maluku",Jenjang Pendidikan SMA,9.0909
5205,"Kab. Dompu, Nusa Tenggara Barat",Jenjang Pendidikan SMA,9.0253
8108,"Kab. Maluku Barat Daya, Maluku",Jenjang Pendidikan SMA,8.9552
1217,"Kab. Samosir, Sumatera Utara",Jenjang Pendidikan SMA,8.8757
7604,"Kab. Mamuju, Sulawesi Barat",Jenjang Pendidikan SMA,8.8608
8106,"Kab. Seram Bagian Barat, Maluku",Jenjang Pendidikan SMA,8.8496
8202,"Kab. Halmahera Tengah, Maluku Utara",Jenjang Pendidikan SMA,8.8235
1902,"Kab. Belitung, Bangka Belitung",Jenjang Pendidikan SMA,8.7912
5314,"Kab. Rote-Ndao, Nusa Tenggara Timur",Jenjang Pendidikan SMA,8.7838
1203,"Kab. Tapanuli Selatan, Sumatera Utara",Jenjang Pendidikan SMA,8.7591
5272,"Kota Bima, Nusa Tenggara Barat",Jenjang Pendidikan SMA,8.6538
1110,"Kab. Bireuen, Aceh",Jenjang Pendidikan SMA,8.3732
7409,"Kab. Buton Utara, Sulawesi Tenggara",Jenjang Pendidikan SMA,8.3333
3321,"Kab. Demak, Jawa Tengah",Jenjang Pendidikan SMA,8.3141
8201,"Kab. Halmahera Barat, Maluku Utara",Jenjang Pendidikan SMA,8.2192
7316,"Kab. Enrekang, Sulawesi Selatan",Jenjang Pendidikan SMA,8.0321
1404,"Kab. Pelalawan, Riau",Jenjang Pendidikan SMA,7.971
7307,"Kab. Sinjai, Sulawesi Selatan",Jenjang Pendidikan SMA,7.8652
8171,"Kota Ambon, Maluku",Jenjang Pendidikan SMA,7.8522
9427,"Kab. Supiori, Papua",Jenjang Pendidikan SMA,7.8431
3205,"Kab. Garut, Jawa Barat",Jenjang Pendidikan SMA,7.8125
1109,"Kab. Pidie, Aceh",Jenjang Pendidikan SMA,7.7922
1304,"Kab. Sijunjung, Sumatera Barat",Jenjang Pendidikan SMA,7.7348
7325,"Kab. Luwu Timur, Sulawesi Selatan",Jenjang Pendidikan SMA,7.6023
3212,"Kab. Indramayu, Jawa Barat",Jenjang Pendidikan SMA,7.5949
7206,"Kab. Tolitoli, Sulawesi Tengah",Jenjang Pendidikan SMA,7.4074
7313,"Kab. Wajo, Sulawesi Selatan",Jenjang Pendidikan SMA,7.3944
7172,"Kota Bitung, Sulawesi Utara",Jenjang Pendidikan SMA,7.2464
9411,"Kab. Puncak Jaya, Papua",Jenjang Pendidikan SMA,7.1429
1221,"Kab. Padang Lawas, Sumatera Utara",Jenjang Pendidikan SMA,7.1429
7414,"Kab. Buton Tengah, Sulawesi Tenggara",Jenjang Pendidikan SMA,7.1429
3304,"Kab. Banjarnegara, Jawa Tengah",Jenjang Pendidikan SMA,7.113
3214,"Kab. Purwakarta, Jawa Barat",Jenjang Pendidikan SMA,7.0755
3210,"Kab. Majalengka, Jawa Barat",Jenjang Pendidikan SMA,7.0664
3202,"Kab. Sukabumi, Jawa Barat",Jenjang Pendidikan SMA,7.0313
3524,"Kab. Lamongan, Jawa Timur",Jenjang Pendidikan SMA,7.0201
7311,"Kab. Bone, Sulawesi Selatan",Jenjang Pendidikan SMA,6.9579
1709,"Kab. Bengkulu Tengah, Bengkulu",Jenjang Pendidikan SMA,6.7961
1806,"Kab. Lampung Utara, Lampung",Jenjang Pendidikan SMA,6.7834
5316,"Kab. Sumba Tengah, Nusa Tenggara Timur",Jenjang Pendidikan SMA,6.7797
3518,"Kab. Nganjuk, Jawa Timur",Jenjang Pendidikan SMA,6.7308
1607,"Kab. Banyuasin, Sumatera Selatan",Jenjang Pendidikan SMA,6.7227
8272,"Kota Tidore Kepulauan, Maluku Utara",Jenjang Pendidikan SMA,6.7039
3519,"Kab. Madiun, Jawa Timur",Jenjang Pendidikan SMA,6.6946
5319,"Kab. Manggarai Timur, Nusa Tenggara Timur",Jenjang Pendidikan SMA,6.6456
1105,"Kab. Aceh Timur, Aceh",Jenjang Pendidikan SMA,6.5714
1406,"Kab. Kampar, Riau",Jenjang Pendidikan SMA,6.5053
6208,"Kab. Seruyan, Kalimantan Tengah",Jenjang Pendidikan SMA,6.4815
7212,"Kab. Morowali Utara, Sulawesi Tengah",Jenjang Pendidikan SMA,6.422
5311,"Kab. Ende, Nusa Tenggara Timur",Jenjang Pendidikan SMA,6.3898
5271,"Kota Mataram, Nusa Tenggara Barat",Jenjang Pendidikan SMA,6.3889
7103,"Kab. Kep. Sangihe, Sulawesi Utara",Jenjang Pendidikan SMA,6.338
7102,"Kab. Minahasa, Sulawesi Utara",Jenjang Pendidikan SMA,6.3361
3301,"Kab. Cilacap, Jawa Tengah",Jenjang Pendidikan SMA,6.3333
1708,"Kab. Kepahiang, Bengkulu",Jenjang Pendidikan SMA,6.3063
3216,"Kab. Bekasi, Jawa Barat",Jenjang Pendidikan SMA,6.2674
1171,"Kota Banda Aceh, Aceh",Jenjang Pendidikan SMA,6.2651
3217,"Kab. Bandung Barat, Jawa Barat",Jenjang Pendidikan SMA,6.2598
6111,"Kab. Kayong Utara, Kalimantan Barat",Jenjang Pendidikan SMA,6.25
9109,"Kab. Tambrauw, Papua Barat",Jenjang Pendidikan SMA,6.25
3521,"Kab. Ngawi, Jawa Timur",Jenjang Pendidikan SMA,6.25
6211,"Kab. Gunung Mas, Kalimantan Tengah",Jenjang Pendidikan SMA,6.25
9106,"Kab. Sorong Selatan, Papua Barat",Jenjang Pendidikan SMA,6.25
3324,"Kab. Kendal, Jawa Tengah",Jenjang Pendidikan SMA,6.25
3314,"Kab. Sragen, Jawa Tengah",Jenjang Pendidikan SMA,6.2338
1271,"Kota Sibolga, Sumatera Utara",Jenjang Pendidikan SMA,6.2016
3277,"Kota Cimahi, Jawa Barat",Jenjang Pendidikan SMA,6.1856
1471,"Kota Pekanbaru, Riau",Jenjang Pendidikan SMA,6.1844
7204,"Kab. Poso, Sulawesi Tengah",Jenjang Pendidikan SMA,6.1404
1808,"Kab. Tulang Bawang, Lampung",Jenjang Pendidikan SMA,6.1033
1602,"Kab. Ogan Komering Ilir, Sumatera Selatan",Jenjang Pendidikan SMA,6.0738
8104,"Kab. Buru, Maluku",Jenjang Pendidikan SMA,6.0606
1803,"Kab. Lampung Selatan, Lampung",Jenjang Pendidikan SMA,6.0311
3511,"Kab. Bondowoso, Jawa Timur",Jenjang Pendidikan SMA,6.0241
1703,"Kab. Bengkulu Utara, Bengkulu",Jenjang Pendidikan SMA,6.0185
8208,"Kab. Pulau Taliabu, Maluku Utara",Jenjang Pendidikan SMA,6
6305,"Kab. Tapin, Kalimantan Selatan",Jenjang Pendidikan SMA,5.8824
7303,"Kab. Bantaeng, Sulawesi Selatan",Jenjang Pendidikan SMA,5.8824
3272,"Kota Sukabumi, Jawa Barat",Jenjang Pendidikan SMA,5.8608
1606,"Kab. Musi Banyuasin, Sumatera Selatan",Jenjang Pendidikan SMA,5.8468
6210,"Kab. Pulang Pisau, Kalimantan Tengah",Jenjang Pendidikan SMA,5.8394
5203,"Kab. Lombok Timur, Nusa Tenggara Barat",Jenjang Pendidikan SMA,5.8268
3206,"Kab. Tasikmalaya, Jawa Barat",Jenjang Pendidikan SMA,5.7996
7101,"Kab. Bolaang Mongondow, Sulawesi Utara",Jenjang Pendidikan SMA,5.7851
7404,"Kab. Kolaka, Sulawesi Tenggara",Jenjang Pendidikan SMA,5.7692
1801,"Kab. Lampung Barat, Lampung",Jenjang Pendidikan SMA,5.7416
3274,"Kota Cirebon, Jawa Barat",Jenjang Pendidikan SMA,5.7214
1216,"Kab. Pakpak Bharat, Sumatera Utara",Jenjang Pendidikan SMA,5.7143
3526,"Kab. Bangkalan, Jawa Timur",Jenjang Pendidikan SMA,5.6769
1410,"Kab. Kepulauan Meranti, Riau",Jenjang Pendidikan SMA,5.6701
1108,"Kab. Aceh Besar, Aceh",Jenjang Pendidikan SMA,5.5556
1276,"Kota Binjai, Sumatera Utara",Jenjang Pendidikan SMA,5.4662
6110,"Kab. Melawi, Kalimantan Barat",Jenjang Pendidikan SMA,5.4645
3528,"Kab. Pamekasan, Jawa Timur",Jenjang Pendidikan SMA,5.4187
1613,"Kab. Musi Rawas Utara, Sumatera Selatan",Jenjang Pendidikan SMA,5.3846
3211,"Kab. Sumedang, Jawa Barat",Jenjang Pendidikan SMA,5.3333
1904,"Kab. Bangka Tengah, Bangka Belitung",Jenjang Pendidikan SMA,5.3191
2102,"Kab. Bintan, Kepulauan Riau",Jenjang Pendidikan SMA,5.3097
1610,"Kab. Ogan Ilir, Sumatera Selatan",Jenjang Pendidikan SMA,5.2632
1409,"Kab. Rokan Hilir, Riau",Jenjang Pendidikan SMA,5.2632
1371,"Kota Padang, Sumatera Barat",Jenjang Pendidikan SMA,5.2443
1308,"Kab. Lima Puluh Koto, Sumatera Barat",Jenjang Pendidikan SMA,5.2239
1311,"Kab. Dharmasraya, Sumatera Barat",Jenjang Pendidikan SMA,5.2083
1903,"Kab. Bangka Barat, Bangka Belitung",Jenjang Pendidikan SMA,5.0725
1115,"Kab. Nagan Raya, Aceh",Jenjang Pendidikan SMA,5.0505
8102,"Kab. Maluku Tenggara, Maluku",Jenjang Pendidikan SMA,5
7372,"Kota Parepare, Sulawesi Selatan",Jenjang Pendidikan SMA,4.9296
6112,"Kab. Kuburaya, Kalimantan Barat",Jenjang Pendidikan SMA,4.9223
3576,"Kota Mojokerto, Jawa Timur",Jenjang Pendidikan SMA,4.908
1810,"Kab. Pringsewu, Lampung",Jenjang Pendidikan SMA,4.908
5310,"Kab. Sikka, Nusa Tenggara Timur",Jenjang Pendidikan SMA,4.886
7406,"Kab. Bombana, Sulawesi Tenggara",Jenjang Pendidikan SMA,4.7872
7501,"Kab. Boalemo, Gorontalo",Jenjang Pendidikan SMA,4.7619
3215,"Kab. Karawang, Jawa Barat",Jenjang Pendidikan SMA,4.7619
3672,"Kota Cilegon, Banten",Jenjang Pendidikan SMA,4.7059
1215,"Kab. Humbang Hasudutan, Sumatera Utara",Jenjang Pendidikan SMA,4.6414
3401,"Kab. Kulon Progo, D.I. Yogyakarta",Jenjang Pendidikan SMA,4.5455
5318,"Kab. Nagakeo, Nusa Tenggara Timur",Jenjang Pendidikan SMA,4.5455
1804,"Kab. Lampung Timur, Lampung",Jenjang Pendidikan SMA,4.4574
6207,"Kab. Lamandau, Kalimantan Tengah",Jenjang Pendidikan SMA,4.4444
7104,"Kab. Kepulauan Talaud, Sulawesi Utara",Jenjang Pendidikan SMA,4.4025
7407,"Kab. Wakatobi, Sulawesi Tenggara",Jenjang Pendidikan SMA,4.3689
1671,"Kota Palembang, Sumatera Selatan",Jenjang Pendidikan SMA,4.3585
8105,"Kab. Kepulauan Aru, Maluku",Jenjang Pendidikan SMA,4.3478
1611,"Kab. Empat Lawang, Sumatera Selatan",Jenjang Pendidikan SMA,4.3478
7317,"Kab. Luwu, Sulawesi Selatan",Jenjang Pendidikan SMA,4.3243
3509,"Kab. Jember, Jawa Timur",Jenjang Pendidikan SMA,4.2553
1213,"Kab. Langkat, Sumatera Utara",Jenjang Pendidikan SMA,4.2517
3326,"Kab. Pekalongan, Jawa Tengah",Jenjang Pendidikan SMA,4.2403
1603,"Kab. Muara Enim, Sumatera Selatan",Jenjang Pendidikan SMA,4.2394
7207,"Kab. Buol, Sulawesi Tengah",Jenjang Pendidikan SMA,4.2017
7318,"Kab. Tana Toraja, Sulawesi Selatan",Jenjang Pendidikan SMA,4.2017
3316,"Kab. Blora, Jawa Tengah",Jenjang Pendidikan SMA,4.1935
7304,"Kab. Jeneponto, Sulawesi Selatan",Jenjang Pendidikan SMA,4.1841
1608,"Kab. Ogan Komering Ulu Selatan, Sumatera Selatan",Jenjang Pendidikan SMA,4.1825
5371,"Kota Kupang, Nusa Tenggara Timur",Jenjang Pendidikan SMA,4.1667
1218,"Kab. Serdang Bedagai, Sumatera Utara",Jenjang Pendidikan SMA,4.1056
1103,"Kab. Aceh Selatan, Aceh",Jenjang Pendidikan SMA,4.1009
1407,"Kab. Rokan Hulu, Riau",Jenjang Pendidikan SMA,4.0872
7174,"Kota Kotamobagu, Sulawesi Utara",Jenjang Pendidikan SMA,4.0541
3317,"Kab. Rembang, Jawa Tengah",Jenjang Pendidikan SMA,4.0161
9110,"Kab. Maybrat, Papua Barat",Jenjang Pendidikan SMA,4
3213,"Kab. Subang, Jawa Barat",Jenjang Pendidikan SMA,3.9557
9410,"Kab. Paniai, Papua",Jenjang Pendidikan SMA,3.9216
5320,"Kab. Sabu Raijua, Nusa Tenggara Timur",Jenjang Pendidikan SMA,3.9063
3318,"Kab. Pati, Jawa Tengah",Jenjang Pendidikan SMA,3.8991
1701,"Kab. Bengkulu Selatan, Bengkulu",Jenjang Pendidikan SMA,3.8961
7308,"Kab. Maros, Sulawesi Selatan",Jenjang Pendidikan SMA,3.8806
1802,"Kab. Tanggamus, Lampung",Jenjang Pendidikan SMA,3.8596
1305,"Kab. Tanah Datar, Sumatera Barat",Jenjang Pendidikan SMA,3.8348
1405,"Kab. Siak, Riau",Jenjang Pendidikan SMA,3.8278
7309,"Kab. Pangkajene Kepulauan, Sulawesi Selatan",Jenjang Pendidikan SMA,3.8062
8103,"Kab. Maluku Tengah, Maluku",Jenjang Pendidikan SMA,3.8028
1609,"Kab. Ogan Komering Ulu Timur, Sumatera Selatan",Jenjang Pendidikan SMA,3.7825
6203,"Kab. Kapuas, Kalimantan Tengah",Jenjang Pendidikan SMA,3.7736
3529,"Kab. Sumenep, Jawa Timur",Jenjang Pendidikan SMA,3.7594
1277,"Kota Padang Sidimpuan, Sumatera Utara",Jenjang Pendidikan SMA,3.7594
1673,"Kota Pagar Alam, Sumatera Selatan",Jenjang Pendidikan SMA,3.75
6104,"Kab. Mempawah, Kalimantan Barat",Jenjang Pendidikan SMA,3.7267
1805,"Kab. Lampung Tengah, Lampung",Jenjang Pendidikan SMA,3.7143
3207,"Kab. Ciamis, Jawa Barat",Jenjang Pendidikan SMA,3.6952
1212,"Kab. Deli Serdang, Sumatera Utara",Jenjang Pendidikan SMA,3.6786
1704,"Kab. Kaur, Bengkulu",Jenjang Pendidikan SMA,3.6496
5302,"Kab. Sumba Timur, Nusa Tenggara Timur",Jenjang Pendidikan SMA,3.6364
1812,"Kab. Tulang Bawang Barat, Lampung",Jenjang Pendidikan SMA,3.6364
7211,"Kab. Banggai Laut, Sulawesi Tengah",Jenjang Pendidikan SMA,3.6364
7171,"Kota Manado, Sulawesi Utara",Jenjang Pendidikan SMA,3.6145
3603,"Kab. Tangerang, Banten",Jenjang Pendidikan SMA,3.5664
1307,"Kab. Agam, Sumatera Barat",Jenjang Pendidikan SMA,3.5616
1571,"Kota Jambi, Jambi",Jenjang Pendidikan SMA,3.5211
3325,"Kab. Batang, Jawa Tengah",Jenjang Pendidikan SMA,3.5
9426,"Kab. Waropen, Papua",Jenjang Pendidikan SMA,3.4483
9401,"Kab. Merauke, Papua",Jenjang Pendidikan SMA,3.3816
7173,"Kota Tomohon, Sulawesi Utara",Jenjang Pendidikan SMA,3.3557
1503,"Kab. Sarolangun, Jambi",Jenjang Pendidikan SMA,3.3333
3523,"Kab. Tuban, Jawa Timur",Jenjang Pendidikan SMA,3.3333
6102,"Kab. Bengkayang, Kalimantan Barat",Jenjang Pendidikan SMA,3.3333
1674,"Kota Lubuk Linggau, Sumatera Selatan",Jenjang Pendidikan SMA,3.3223
6204,"Kab. Barito Selatan, Kalimantan Tengah",Jenjang Pendidikan SMA,3.3113
7315,"Kab. Pinrang, Sulawesi Selatan",Jenjang Pendidikan SMA,3.2967
7205,"Kab. Donggala, Sulawesi Tengah",Jenjang Pendidikan SMA,3.2864
3323,"Kab. Temanggung, Jawa Tengah",Jenjang Pendidikan SMA,3.271
1501,"Kab. Kerinci, Jambi",Jenjang Pendidikan SMA,3.2558
3374,"Kota Semarang, Jawa Tengah",Jenjang Pendidikan SMA,3.2542
1504,"Kab. Batang Hari, Jambi",Jenjang Pendidikan SMA,3.2432
3502,"Kab. Ponorogo, Jawa Timur",Jenjang Pendidikan SMA,3.183
1809,"Kab. Pesawaran, Lampung",Jenjang Pendidikan SMA,3.1818
7314,"Kab. Sidenreng Rappang, Sulawesi Selatan",Jenjang Pendidikan SMA,3.1532
1114,"Kab. Aceh Tamiang, Aceh",Jenjang Pendidikan SMA,3.1056
5306,"Kab. Belu, Nusa Tenggara Timur",Jenjang Pendidikan SMA,3.0612
7373,"Kota Palopo, Sulawesi Selatan",Jenjang Pendidikan SMA,3.0612
7306,"Kab. Gowa, Sulawesi Selatan",Jenjang Pendidikan SMA,3.0426
3315,"Kab. Grobogan, Jawa Tengah",Jenjang Pendidikan SMA,3.0369
1506,"Kab. Tanjung Jabung Timur, Jambi",Jenjang Pendidikan SMA,2.9412
3375,"Kota Pekalongan, Jawa Tengah",Jenjang Pendidikan SMA,2.9412
8206,"Kab. Halmahera Timur, Maluku Utara",Jenjang Pendidikan SMA,2.9126
3328,"Kab. Tegal, Jawa Tengah",Jenjang Pendidikan SMA,2.9101
7210,"Kab. Sigi, Sulawesi Tengah",Jenjang Pendidikan SMA,2.8571
6201,"Kab. Kotawaringin Barat, Kalimantan Tengah",Jenjang Pendidikan SMA,2.8409
5201,"Kab. Lombok Barat, Nusa Tenggara Barat",Jenjang Pendidikan SMA,2.8391
1601,"Kab. Ogan Komering Ulu, Sumatera Selatan",Jenjang Pendidikan SMA,2.8391
7302,"Kab. Bulukumba, Sulawesi Selatan",Jenjang Pendidikan SMA,2.8351
6304,"Kab. Barito Kuala, Kalimantan Selatan",Jenjang Pendidikan SMA,2.8037
1408,"Kab. Bengkalis, Riau",Jenjang Pendidikan SMA,2.7821
6503,"Kab. Tana Tidung, Kalimantan Utara",Jenjang Pendidikan SMA,2.7778
1401,"Kab. Kuantan Singingi, Riau",Jenjang Pendidikan SMA,2.7586
3671,"Kota Tangerang, Banten",Jenjang Pendidikan SMA,2.7254
1509,"Kab. Bungo, Jambi",Jenjang Pendidikan SMA,2.6923
3278,"Kota Tasikmalaya, Jawa Barat",Jenjang Pendidikan SMA,2.6667
6472,"Kota Samarinda, Kalimantan Timur",Jenjang Pendidikan SMA,2.6667
7208,"Kab. Parigi Moutong, Sulawesi Tengah",Jenjang Pendidikan SMA,2.6578
3516,"Kab. Mojokerto, Jawa Timur",Jenjang Pendidikan SMA,2.6549
7108,"Kab. Kepulauan Sitaro, Sulawesi Utara",Jenjang Pendidikan SMA,2.6316
7310,"Kab. Barru, Sulawesi Selatan",Jenjang Pendidikan SMA,2.6144
7602,"Kab. Polewali Mandar, Sulawesi Barat",Jenjang Pendidikan SMA,2.5751
3513,"Kab. Probolinggo, Jawa Timur",Jenjang Pendidikan SMA,2.5641
1312,"Kab. Pasaman Barat, Sumatera Barat",Jenjang Pendidikan SMA,2.5455
3525,"Kab. Gresik, Jawa Timur",Jenjang Pendidikan SMA,2.5185
5204,"Kab. Sumbawa, Nusa Tenggara Barat",Jenjang Pendidikan SMA,2.5078
3203,"Kab. Cianjur, Jawa Barat",Jenjang Pendidikan SMA,2.506
9111,"Kab. Manokwari Selatan, Papua Barat",Jenjang Pendidikan SMA,2.5
3512,"Kab. Situbondo, Jawa Timur",Jenjang Pendidikan SMA,2.4911
3204,"Kab. Bandung, Jawa Barat",Jenjang Pendidikan SMA,2.4887
6171,"Kota Pontianak, Kalimantan Barat",Jenjang Pendidikan SMA,2.4793
3517,"Kab. Jombang, Jawa Timur",Jenjang Pendidikan SMA,2.4263
9104,"Kab. Teluk Bintuni, Papua Barat",Jenjang Pendidikan SMA,2.4096
6301,"Kab. Tanah Laut, Kalimantan Selatan",Jenjang Pendidikan SMA,2.4038
6271,"Kota Palangka Raya, Kalimantan Tengah",Jenjang Pendidikan SMA,2.3891
3273,"Kota Bandung, Jawa Barat",Jenjang Pendidikan SMA,2.376
3302,"Kab. Banyumas, Jawa Tengah",Jenjang Pendidikan SMA,2.3659
6311,"Kab. Balangan, Kalimantan Selatan",Jenjang Pendidikan SMA,2.3529
7106,"Kab. Minahasa Utara, Sulawesi Utara",Jenjang Pendidikan SMA,2.3529
6401,"Kab. Paser, Kalimantan Timur",Jenjang Pendidikan SMA,2.3529
9402,"Kab. Jaya Wijaya, Papua",Jenjang Pendidikan SMA,2.3256
9107,"Kab. Sorong, Papua Barat",Jenjang Pendidikan SMA,2.3077
3322,"Kab. Semarang, Jawa Tengah",Jenjang Pendidikan SMA,2.267
7371,"Kota Makassar, Sulawesi Selatan",Jenjang Pendidikan SMA,2.2362
6309,"Kab. Tabalong, Kalimantan Selatan",Jenjang Pendidikan SMA,2.2059
9412,"Kab. Mimika, Papua",Jenjang Pendidikan SMA,2.1978
3306,"Kab. Purworejo, Jawa Tengah",Jenjang Pendidikan SMA,2.1672
9409,"Kab. Biak Numfor, Papua",Jenjang Pendidikan SMA,2.1622
3329,"Kab. Brebes, Jawa Tengah",Jenjang Pendidikan SMA,2.1201
3514,"Kab. Pasuruan, Jawa Timur",Jenjang Pendidikan SMA,2.069
3471,"Kota Yogyakarta, D.I. Yogyakarta",Jenjang Pendidikan SMA,2.0679
3310,"Kab. Klaten, Jawa Tengah",Jenjang Pendidikan SMA,2.0243
6405,"Kab. Berau, Kalimantan Timur",Jenjang Pendidikan SMA,1.9802
5104,"Kab. Gianyar, Bali",Jenjang Pendidikan SMA,1.9704
7502,"Kab. Gorontalo, Gorontalo",Jenjang Pendidikan SMA,1.9643
1612,"Kab. Penukal Abab Lematang Ilir, Sumatera Selatan",Jenjang Pendidikan SMA,1.9481
1508,"Kab. Tebo, Jambi",Jenjang Pendidikan SMA,1.9231
3308,"Kab. Magelang, Jawa Tengah",Jenjang Pendidikan SMA,1.9149
1211,"Kab. Karo, Sumatera Utara",Jenjang Pendidikan SMA,1.9126
3201,"Kab. Bogor, Jawa Barat",Jenjang Pendidikan SMA,1.9112
7505,"Kab. Gorontalo Utara, Gorontalo",Jenjang Pendidikan SMA,1.9108
9105,"Kab. Manokwari, Papua Barat",Jenjang Pendidikan SMA,1.9048
7401,"Kab. Buton, Sulawesi Tenggara",Jenjang Pendidikan SMA,1.8957
7472,"Kota Baubau, Sulawesi Tenggara",Jenjang Pendidikan SMA,1.8605
1871,"Kota Bandar Lampung, Lampung",Jenjang Pendidikan SMA,1.8559
1202,"Kab. Mandailing Natal, Sumatera Utara",Jenjang Pendidikan SMA,1.8116
6209,"Kab. Katingan, Kalimantan Tengah",Jenjang Pendidikan SMA,1.7857
3175,"Kota Jakarta Utara, D.K.I. Jakarta",Jenjang Pendidikan SMA,1.7689
3504,"Kab. Tulungagung, Jawa Timur",Jenjang Pendidikan SMA,1.7677
3305,"Kab. Kebumen, Jawa Tengah",Jenjang Pendidikan SMA,1.75
7271,"Kota Palu, Sulawesi Tengah",Jenjang Pendidikan SMA,1.7157
3673,"Kota Serang, Banten",Jenjang Pendidikan SMA,1.6713
1273,"Kota Pematangsiantar, Sumatera Utara",Jenjang Pendidikan SMA,1.6701
1605,"Kab. Musi Rawas, Sumatera Selatan",Jenjang Pendidikan SMA,1.6234
7203,"Kab. Morowali, Sulawesi Tengah",Jenjang Pendidikan SMA,1.5873
3578,"Kota Surabaya, Jawa Timur",Jenjang Pendidikan SMA,1.5256
6105,"Kab. Sanggau, Kalimantan Barat",Jenjang Pendidikan SMA,1.5152
1473,"Kota Dumai, Riau",Jenjang Pendidikan SMA,1.5152
3171,"Kota Jakarta Selatan, D.K.I. Jakarta",Jenjang Pendidikan SMA,1.5108
1872,"Kota Metro, Lampung",Jenjang Pendidikan SMA,1.5094
7605,"Kab. Mamuju Utara, Sulawesi Barat",Jenjang Pendidikan SMA,1.5038
3510,"Kab. Banyuwangi, Jawa Timur",Jenjang Pendidikan SMA,1.5015
2171,"Kota Batam, Kepulauan Riau",Jenjang Pendidikan SMA,1.4706
6213,"Kab. Murung Raya, Kalimantan Tengah",Jenjang Pendidikan SMA,1.4286
1208,"Kab. Asahan, Sumatera Utara",Jenjang Pendidikan SMA,1.4141
3271,"Kota Bogor, Jawa Barat",Jenjang Pendidikan SMA,1.4104
3307,"Kab. Wonosobo, Jawa Tengah",Jenjang Pendidikan SMA,1.4085
5208,"Kab. Lombok Utara, Nusa Tenggara Barat",Jenjang Pendidikan SMA,1.3986
5108,"Kab. Buleleng, Bali",Jenjang Pendidikan SMA,1.3917
1117,"Kab. Bener Meriah, Aceh",Jenjang Pendidikan SMA,1.3825
1309,"Kab. Pasaman, Sumatera Barat",Jenjang Pendidikan SMA,1.3825
3579,"Kota Batu, Jawa Timur",Jenjang Pendidikan SMA,1.3699
1278,"Kota Gunungsitoli, Sumatera Utara",Jenjang Pendidikan SMA,1.3699
6101,"Kab. Sambas, Kalimantan Barat",Jenjang Pendidikan SMA,1.3661
6402,"Kab. Kutai Barat, Kalimantan Timur",Jenjang Pendidikan SMA,1.3514
1771,"Kota Bengkulu, Bengkulu",Jenjang Pendidikan SMA,1.3405
5107,"Kab. Karang Asem, Bali",Jenjang Pendidikan SMA,1.3333
1209,"Kab. Simalungun, Sumatera Utara",Jenjang Pendidikan SMA,1.3136
7305,"Kab. Takalar, Sulawesi Selatan",Jenjang Pendidikan SMA,1.3072
1303,"Kab. Solok, Sumatera Barat",Jenjang Pendidikan SMA,1.2903
5102,"Kab. Tabanan, Bali",Jenjang Pendidikan SMA,1.2876
3508,"Kab. Lumajang, Jawa Timur",Jenjang Pendidikan SMA,1.2658
3327,"Kab. Pemalang, Jawa Tengah",Jenjang Pendidikan SMA,1.2315
6106,"Kab. Ketapang, Kalimantan Barat",Jenjang Pendidikan SMA,1.2308
6109,"Kab. Sekadau, Kalimantan Barat",Jenjang Pendidikan SMA,1.227
3311,"Kab. Sukoharjo, Jawa Tengah",Jenjang Pendidikan SMA,1.182
