KODE_KAB,KABUPATEN,JENJANG_PENDIDIKAN,PCT_BERAT
3402,"Kab. Bantul, D.I. Yogyakarta",Jenjang Pendidikan SMA,1.1321
1207,"Kab. Labuhan Batu, Sumatera Utara",Jenjang Pendidikan SMA,1.1111
1706,"Kab. Muko-muko, Bengkulu",Jenjang Pendidikan SMA,1.087
1402,"Kab. Indragiri Hulu, Riau",Jenjang Pendidikan SMA,1.0753
8205,"Kab. halmahera Utara, Maluku Utara",Jenjang Pendidikan SMA,1.0204
3674,"Kota Tangerang Selatan, Banten",Jenjang Pendidikan SMA,1.0056
3303,"Kab. Purbalingga, Jawa Tengah",Jenjang Pendidikan SMA,0.9709
7105,"Kab. Minahasa Selatan, Sulawesi Utara",Jenjang Pendidikan SMA,0.9615
3173,"Kota Jakarta Pusat, D.K.I. Jakarta",Jenjang Pendidikan SMA,0.9245
1306,"Kab. Padang Pariaman, Sumatera Barat",Jenjang Pendidikan SMA,0.9091
3507,"Kab. Malang, Jawa Timur",Jenjang Pendidikan SMA,0.9079
1219,"Kab. Batubara, Sumatera Utara",Jenjang Pendidikan SMA,0.8929
6502,"Kab. Bulungan, Kalimantan Utara",Jenjang Pendidikan SMA,0.8696
5207,"Kab. Sumbawa Barat, Nusa Tenggara Barat",Jenjang Pendidikan SMA,0.8621
3320,"Kab. Jepara, Jawa Tengah",Jenjang Pendidikan SMA,0.8427
3276,"Kota Depok, Jawa Barat",Jenjang Pendidikan SMA,0.8345
6302,"Kab. Kota Baru, Kalimantan Selatan",Jenjang Pendidikan SMA,0.8333
3218,"Kab. Pangandaran, Jawa Barat",Jenjang Pendidikan SMA,0.8197
6403,"Kab. Kutai Kartanegara, Kalimantan Timur",Jenjang Pendidikan SMA,0.818
1113,"Kab. Gayo Lues, Aceh",Jenjang Pendidikan SMA,0.813
1572,"Kota Sungai Penuh, Jambi",Jenjang Pendidikan SMA,0.8
1275,"Kota Medan, Sumatera Utara",Jenjang Pendidikan SMA,0.7137
1505,"Kab. Muaro Jambi, Jambi",Jenjang Pendidikan SMA,0.7117
5106,"Kab. Bangli, Bali",Jenjang Pendidikan SMA,0.7092
1102,"Kab. Aceh Singkil, Aceh",Jenjang Pendidikan SMA,0.6993
6303,"Kota Banjar, Jawa Barat",Jenjang Pendidikan SMA,0.69765
6504,"Kab. Nunukan, Kalimantan Utara",Jenjang Pendidikan SMA,0.6452
3319,"Kab. Kudus, Jawa Tengah",Jenjang Pendidikan SMA,0.641
3501,"Kab. Pacitan, Jawa Timur",Jenjang Pendidikan SMA,0.6329
3313,"Kab. Karanganyar, Jawa Tengah",Jenjang Pendidikan SMA,0.6309
3275,"Kota Bekasi, Jawa Barat",Jenjang Pendidikan SMA,0.622
2172,"Kota Tanjungpinang, Kepulauan Riau",Jenjang Pendidikan SMA,0.6061
1310,"Kab. Solok Selatan, Sumatera Barat",Jenjang Pendidikan SMA,0.6024
3404,"Kab. Sleman, D.I. Yogyakarta",Jenjang Pendidikan SMA,0.5964
5101,"Kab. Jembrana, Bali",Jenjang Pendidikan SMA,0.5682
1222,"Kab. Labuhan Batu Selatan, Sumatera Utara",Jenjang Pendidikan SMA,0.5556
6172,"Kota Singkawang, Kalimantan Barat",Jenjang Pendidikan SMA,0.5495
1174,"Kota Lhokseumawe, Aceh",Jenjang Pendidikan SMA,0.5025
3577,"Kota Madiun, Jawa Timur",Jenjang Pendidikan SMA,0.5
3506,"Kab. Kediri, Jawa Timur",Jenjang Pendidikan SMA,0.4926
1112,"Kab. Aceh Barat Daya, Aceh",Jenjang Pendidikan SMA,0.4902
6371,"Kota Banjarmasin, Kalimantan Selatan",Jenjang Pendidikan SMA,0.4684
1107,"Kab. Aceh Barat, Aceh",Jenjang Pendidikan SMA,0.4545
2101,"Kab. Karimun, Kepulauan Riau",Jenjang Pendidikan SMA,0.4464
1274,"Kota Tebing Tinggi, Sumatera Utara",Jenjang Pendidikan SMA,0.4292
6202,"Kab. Kotawaringin Timur, Kalimantan Tengah",Jenjang Pendidikan SMA,0.4
5171,"Kota Denpasar, Bali",Jenjang Pendidikan SMA,0.396
3403,"Kab. Gunung Kidul, D.I. Yogyakarta",Jenjang Pendidikan SMA,0.3922
3503,"Kab. Trenggalek, Jawa Timur",Jenjang Pendidikan SMA,0.3802
6108,"Kab. Kapuas Hulu, Kalimantan Barat",Jenjang Pendidikan SMA,0.365
3505,"Kab. Blitar, Jawa Timur",Jenjang Pendidikan SMA,0.346
3174,"Kota Jakarta Barat, D.K.I. Jakarta",Jenjang Pendidikan SMA,0.3213
3372,"Kota Surakarta, Jawa Tengah",Jenjang Pendidikan SMA,0.316
3515,"Kab. Sidoarjo, Jawa Timur",Jenjang Pendidikan SMA,0.2938
3309,"Kab. Boyolali, Jawa Tengah",Jenjang Pendidikan SMA,0.2174
3172,"Kota Jakarta Timur, D.K.I. Jakarta",Jenjang Pendidikan SMA,0.1767
7326,"Kab. Toraja Utara, Sulawesi Selatan",Jenjang Pendidikan SMA,0
7504,"Kab. Bone Bolango, Gorontalo",Jenjang Pendidikan SMA,0
6471,"Kota Balikpapan, Kalimantan Timur",Jenjang Pendidikan SMA,0
7410,"Kab. Konawe Utara, Sulawesi Tenggara",Jenjang Pendidikan SMA,0
9416,"Kab. Yahukimo, Papua",Jenjang Pendidikan SMA,0
3312,"Kab. Wonogiri, Jawa Tengah",Jenjang Pendidikan SMA,0
1901,"Kab. Bangka, Bangka Belitung",Jenjang Pendidikan SMA,0
2104,"Kab. Lingga, Kepulauan Riau",Jenjang Pendidikan SMA,0
1705,"Kab. Seluma, Bengkulu",Jenjang Pendidikan SMA,0
1906,"Kab. Belitung Timur, Bangka Belitung",Jenjang Pendidikan SMA,0
1376,"Kota Payakumbuh, Sumatera Barat",Jenjang Pendidikan SMA,0
1220,"Kab. Padang Lawas utara, Sumatera Utara",Jenjang Pendidikan SMA,0
3101,"Kab. Kepulauan Seribu, D.K.I. Jakarta",Jenjang Pendidikan SMA,0
1206,"Kab. Toba Samosir, Sumatera Utara",Jenjang Pendidikan SMA,0
3571,"Kota Kediri, Jawa Timur",Jenjang Pendidikan SMA,0
6307,"Kab. Hulu Sungai Tengah, Kalimantan Selatan",Jenjang Pendidikan SMA,0
7111,"Kab. Bolaang Mongondow Timur, Sulawesi Utara",Jenjang Pendidikan SMA,0
3520,"Kab. Magetan, Jawa Timur",Jenjang Pendidikan SMA,0
5105,"Kab. Klungkung, Bali",Jenjang Pendidikan SMA,0
9101,"Kab. Fak-Fak, Papua Barat",Jenjang Pendidikan SMA,0
6206,"Kab. Sukamara, Kalimantan Tengah",Jenjang Pendidikan SMA,0
1707,"Kab. Lebong, Bengkulu",Jenjang Pendidikan SMA,0
3371,"Kota Magelang, Jawa Tengah",Jenjang Pendidikan SMA,0
6205,"Kab. Barito Utara, Kalimantan Tengah",Jenjang Pendidikan SMA,0
9413,"Kab. Boven Digoel, Papua",Jenjang Pendidikan SMA,0
1905,"Kab. Bangka Selatan, Bangka Belitung",Jenjang Pendidikan SMA,0
3376,"Kota Tegal, Jawa Tengah",Jenjang Pendidikan SMA,0
1372,"Kota Solok, Sumatera Barat",Jenjang Pendidikan SMA,0
9433,"kab. Puncak, Papua",Jenjang Pendidikan SMA,0
3574,"Kota Probolinggo, Jawa Timur",Jenjang Pendidikan SMA,0
1272,"Kota Tanjung Balai, Sumatera Utara",Jenjang Pendidikan SMA,0
6306,"Kab. Hulu Sungai Selatan, Kalimantan Selatan",Jenjang Pendidikan SMA,0
9408,"Kab. Kepulauan Yapen, Papua",Jenjang Pendidikan SMA,0
3573,"Kota Malang, Jawa Timur",Jenjang Pendidikan SMA,0
9428,"Kab. Memberamo Raya, Papua",Jenjang Pendidikan SMA,0
2105,"Kab. Kepulauan Anambas, Kepulauan Riau",Jenjang Pendidikan SMA,0
1702,"Kab. Rejang Lebong, Bengkulu",Jenjang Pendidikan SMA,0
3373,"Kota Salatiga, Jawa Tengah",Jenjang Pendidikan SMA,0
7322,"Kab. Luwu Utara, Sulawesi Selatan",Jenjang Pendidikan SMA,0
1377,"Kota Pariaman, Sumatera Barat",Jenjang Pendidikan SMA,0
5103,"Kab. Badung, Bali",Jenjang Pendidikan SMA,0
9419,"Kab. Sarmi, Papua",Jenjang Pendidikan SMA,0
3572,"Kota Blitar, Jawa Timur",Jenjang Pendidikan SMA,0
7110,"Kab. Bolaang Mongondow Selatan, Sulawesi Utara",Jenjang Pendidikan SMA,0
9429,"Kab. Nduga, Papua",Jenjang Pendidikan SMA,0
6474,"Kota Bontang, Kalimantan Timur",Jenjang Pendidikan SMA,0
9404,"Kab. Nabire, Papua",Jenjang Pendidikan SMA,0
9432,"Kab. Yalimo, Papua",Jenjang Pendidikan SMA,0
3575,"Kota Pasuruan, Jawa Timur",Jenjang Pendidikan SMA,0
6212,"Kab. Barito Timur, Kalimantan Tengah",Jenjang Pendidikan SMA,0
9415,"Kab. Asmat, Papua",Jenjang Pendidikan SMA,0
6571,"Kota Tarakan, Kalimantan Utara",Jenjang Pendidikan SMA,0
7301,"Kab. Kepulauan Selayar, Sulawesi Selatan",Jenjang Pendidikan SMA,0
1375,"Kota Bukittinggi, Sumatera Barat",Jenjang Pendidikan SMA,0
2103,"Kab. Natuna, Kepulauan Riau",Jenjang Pendidikan SMA,0
9420,"Kab. Keerom, Papua",Jenjang Pendidikan SMA,0
7109,"Kab. Minahasa Tenggara, Sulawesi Utara",Jenjang Pendidikan SMA,0
1971,"Kota Pangkalpinang, Bangka Belitung",Jenjang Pendidikan SMA,0
9103,"Kab. Teluk Wondama, Papua Barat",Jenjang Pendidikan SMA,0
8271,"Kota Ternate, Maluku Utara",Jenjang Pendidikan SMA,0
1373,"Kota Sawah Lunto, Sumatera Barat",Jenjang Pendidikan SMA,0
7601,"Kab. Majene, Sulawesi Barat",Jenjang Pendidikan SMA,0
9418,"Kab. Tolikara, Papua",Jenjang Pendidikan SMA,0
6308,"Kab. Hulu Sungai Utara, Kalimantan Selatan",Jenjang Pendidikan SMA,0
7107,"Kab. Bolaang Mongondow Utara, Sulawesi Utara",Jenjang Pendidikan SMA,0
6372,"Kota Banjarbaru, Kalimantan Selatan",Jenjang Pendidikan SMA,0
7503,"Kab. Pohuwato, Gorontalo",Jenjang Pendidikan SMA,0
9102,"Kab. Kaimana, Papua Barat",Jenjang Pendidikan SMA,0
6411,"Kab. Mahakam Ulu, Kalimantan Timur",Jenjang Pendidikan SMA,0
1672,"Kota Prabumulih, Sumatera Selatan",Jenjang Pendidikan SMA,0
1374,"Kota Padang Panjang, Sumatera Barat",Jenjang Pendidikan SMA,0
1223,"Kab. Labuhan Batu Utara, Sumatera Utara",Jenjang Pendidikan SMA,0