KODE_KAB,KABUPATEN,JENJANG_PENDIDIKAN,PCT_BERAT
1101,"Kab. Simeulue, Aceh",Jenjang Pendidikan SMP,22.9167
1102,"Kab. Aceh Singkil, Aceh",Jenjang Pendidikan SMP,8.6614
1103,"Kab. Aceh Selatan, Aceh",Jenjang Pendidikan SMP,29.0828
1104,"Kab. Aceh Tenggara, Aceh",Jenjang Pendidikan SMP,13.1183
1105,"Kab. Aceh Timur, Aceh",Jenjang Pendidikan SMP,17.4184
1106,"Kab. Aceh Tengah, Aceh",Jenjang Pendidikan SMP,7.4792
1107,"Kab. Aceh Barat, Aceh",Jenjang Pendidikan SMP,13.0159
1108,"Kab. Aceh Besar, Aceh",Jenjang Pendidikan SMP,13.2353
1109,"Kab. Pidie, Aceh",Jenjang Pendidikan SMP,6.4327
1110,"Kab. Bireuen, Aceh",Jenjang Pendidikan SMP,23.0474
1111,"Kab. Aceh Utara, Aceh",Jenjang Pendidikan SMP,23.9316
1112,"Kab. Aceh Barat Daya, Aceh",Jenjang Pendidikan SMP,8.4291
1113,"Kab. Gayo Lues, Aceh",Jenjang Pendidikan SMP,15.2381
1114,"Kab. Aceh Tamiang, Aceh",Jenjang Pendidikan SMP,8.6957
1115,"Kab. Nagan Raya, Aceh",Jenjang Pendidikan SMP,17.4917
1116,"Kab. Aceh Jaya, Aceh",Jenjang Pendidikan SMP,14.9701
1117,"Kab. Bener Meriah, Aceh",Jenjang Pendidikan SMP,2.346
1118,"Kab. Pidie Jaya, Aceh",Jenjang Pendidikan SMP,36.0465
1171,"Kota Banda Aceh, Aceh",Jenjang Pendidikan SMP,5.5263
1172,"Kota Sabang, Aceh",Jenjang Pendidikan SMP,3.9474
1173,"Kota Langsa, Aceh",Jenjang Pendidikan SMP,5.3872
1174,"Kota Lhokseumawe, Aceh",Jenjang Pendidikan SMP,3.6545
1175,"Kota Subulussalam, Aceh",Jenjang Pendidikan SMP,7.4286
1201,"Kab. Nias, Sumatera Utara",Jenjang Pendidikan SMP,18.3206
1202,"Kab. Mandailing Natal, Sumatera Utara",Jenjang Pendidikan SMP,5.4017
1203,"Kab. Tapanuli Selatan, Sumatera Utara",Jenjang Pendidikan SMP,12.2353
1204,"Kab. Tapanuli Tengah, Sumatera Utara",Jenjang Pendidikan SMP,18.7207
1205,"Kab. Tapanuli Utara, Sumatera Utara",Jenjang Pendidikan SMP,6.2422
1206,"Kab. Toba Samosir, Sumatera Utara",Jenjang Pendidikan SMP,11.5028
1207,"Kab. Labuhan Batu, Sumatera Utara",Jenjang Pendidikan SMP,13.0435
1208,"Kab. Asahan, Sumatera Utara",Jenjang Pendidikan SMP,8.3333
1209,"Kab. Simalungun, Sumatera Utara",Jenjang Pendidikan SMP,11.9542
1210,"Kab. Dairi, Sumatera Utara",Jenjang Pendidikan SMP,5.4015
1211,"Kab. Karo, Sumatera Utara",Jenjang Pendidikan SMP,8.5282
1212,"Kab. Deli Serdang, Sumatera Utara",Jenjang Pendidikan SMP,6.453
1213,"Kab. Langkat, Sumatera Utara",Jenjang Pendidikan SMP,7.2872
1214,"Kab. Nias Selatan, Sumatera Utara",Jenjang Pendidikan SMP,35.7419
1215,"Kab. Humbang Hasudutan, Sumatera Utara",Jenjang Pendidikan SMP,7.2407
1216,"Kab. Pakpak Bharat, Sumatera Utara",Jenjang Pendidikan SMP,5.7325
1217,"Kab. Samosir, Sumatera Utara",Jenjang Pendidikan SMP,12.2093
1218,"Kab. Serdang Bedagai, Sumatera Utara",Jenjang Pendidikan SMP,7.7307
1219,"Kab. Batubara, Sumatera Utara",Jenjang Pendidikan SMP,4.8237
1220,"Kab. Padang Lawas utara, Sumatera Utara",Jenjang Pendidikan SMP,10.7266
1221,"Kab. Padang Lawas, Sumatera Utara",Jenjang Pendidikan SMP,9.1549
1222,"Kab. Labuhan Batu Selatan, Sumatera Utara",Jenjang Pendidikan SMP,2.4793
1223,"Kab. Labuhan Batu Utara, Sumatera Utara",Jenjang Pendidikan SMP,8.0645
1224,"Kab. Nias Utara, Sumatera Utara",Jenjang Pendidikan SMP,17.2932
1225,"Kab. Nias Barat, Sumatera Utara",Jenjang Pendidikan SMP,28.4047
1271,"Kota Sibolga, Sumatera Utara",Jenjang Pendidikan SMP,1.0526
1272,"Kota Tanjung Balai, Sumatera Utara",Jenjang Pendidikan SMP,21.4035
1273,"Kota Pematangsiantar, Sumatera Utara",Jenjang Pendidikan SMP,4.2017
1274,"Kota Tebing Tinggi, Sumatera Utara",Jenjang Pendidikan SMP,1.8018
1275,"Kota Medan, Sumatera Utara",Jenjang Pendidikan SMP,3.3118
1276,"Kota Binjai, Sumatera Utara",Jenjang Pendidikan SMP,3.4417
1277,"Kota Padang Sidimpuan, Sumatera Utara",Jenjang Pendidikan SMP,4.0712
1278,"Kota Gunungsitoli, Sumatera Utara",Jenjang Pendidikan SMP,10.9467
1301,"Kab. Kepulauan Mentawai, Sumatera Barat",Jenjang Pendidikan SMP,6.6667
1302,"Kab. Pesisir Selatan, Sumatera Barat",Jenjang Pendidikan SMP,9.8927
1303,"Kab. Solok, Sumatera Barat",Jenjang Pendidikan SMP,7.5806
1304,"Kab. Sijunjung, Sumatera Barat",Jenjang Pendidikan SMP,2.1053
1305,"Kab. Tanah Datar, Sumatera Barat",Jenjang Pendidikan SMP,3.7767
1306,"Kab. Padang Pariaman, Sumatera Barat",Jenjang Pendidikan SMP,12.6316
1307,"Kab. Agam, Sumatera Barat",Jenjang Pendidikan SMP,16.5278
1308,"Kab. Lima Puluh Koto, Sumatera Barat",Jenjang Pendidikan SMP,4.8822
1309,"Kab. Pasaman, Sumatera Barat",Jenjang Pendidikan SMP,9.7087
1310,"Kab. Solok Selatan, Sumatera Barat",Jenjang Pendidikan SMP,13.3803
1311,"Kab. Dharmasraya, Sumatera Barat",Jenjang Pendidikan SMP,6.3636
1312,"Kab. Pasaman Barat, Sumatera Barat",Jenjang Pendidikan SMP,4.6875
1371,"Kota Padang, Sumatera Barat",Jenjang Pendidikan SMP,3.2695
1372,"Kota Solok, Sumatera Barat",Jenjang Pendidikan SMP,3.4483
1373,"Kota Sawah Lunto, Sumatera Barat",Jenjang Pendidikan SMP,5.8333
1374,"Kota Padang Panjang, Sumatera Barat",Jenjang Pendidikan SMP,6.0811
1375,"Kota Bukittinggi, Sumatera Barat",Jenjang Pendidikan SMP,9.9526
1376,"Kota Payakumbuh, Sumatera Barat",Jenjang Pendidikan SMP,22.028
1377,"Kota Pariaman, Sumatera Barat",Jenjang Pendidikan SMP,1.2658
1401,"Kab. Kuantan Singingi, Riau",Jenjang Pendidikan SMP,4.8544
1402,"Kab. Indragiri Hulu, Riau",Jenjang Pendidikan SMP,10.963
1403,"Kab. Indragiri Hilir, Riau",Jenjang Pendidikan SMP,10.52
1404,"Kab. Pelalawan, Riau",Jenjang Pendidikan SMP,2.3622
1405,"Kab. Siak, Riau",Jenjang Pendidikan SMP,12.2847
1406,"Kab. Kampar, Riau",Jenjang Pendidikan SMP,7.6717
1407,"Kab. Rokan Hulu, Riau",Jenjang Pendidikan SMP,3.2221
1408,"Kab. Bengkalis, Riau",Jenjang Pendidikan SMP,4.8757
1409,"Kab. Rokan Hilir, Riau",Jenjang Pendidikan SMP,10.166
1410,"Kab. Kepulauan Meranti, Riau",Jenjang Pendidikan SMP,21.2996
1471,"Kota Pekanbaru, Riau",Jenjang Pendidikan SMP,1.7279
1473,"Kota Dumai, Riau",Jenjang Pendidikan SMP,5.3738
1501,"Kab. Kerinci, Jambi",Jenjang Pendidikan SMP,15.6818
1502,"Kab. Merangin, Jambi",Jenjang Pendidikan SMP,7.401
1503,"Kab. Sarolangun, Jambi",Jenjang Pendidikan SMP,12.8319
1504,"Kab. Batang Hari, Jambi",Jenjang Pendidikan SMP,8.3333
1505,"Kab. Muaro Jambi, Jambi",Jenjang Pendidikan SMP,6.6781
1506,"Kab. Tanjung Jabung Timur, Jambi",Jenjang Pendidikan SMP,19.7059
1507,"Kab. Tanjung Jabung Barat, Jambi",Jenjang Pendidikan SMP,5.7644
1508,"Kab. Tebo, Jambi",Jenjang Pendidikan SMP,8.7146
1509,"Kab. Bungo, Jambi",Jenjang Pendidikan SMP,9.6838
1571,"Kota Jambi, Jambi",Jenjang Pendidikan SMP,7.6837
1572,"Kota Sungai Penuh, Jambi",Jenjang Pendidikan SMP,20
1601,"Kab. Ogan Komering Ulu, Sumatera Selatan",Jenjang Pendidikan SMP,5.7895
1602,"Kab. Ogan Komering Ilir, Sumatera Selatan",Jenjang Pendidikan SMP,18.0542
1603,"Kab. Muara Enim, Sumatera Selatan",Jenjang Pendidikan SMP,13.3406
1604,"Kab. Lahat, Sumatera Selatan",Jenjang Pendidikan SMP,10.3976
1605,"Kab. Musi Rawas, Sumatera Selatan",Jenjang Pendidikan SMP,12.8814
1606,"Kab. Musi Banyuasin, Sumatera Selatan",Jenjang Pendidikan SMP,15.1546
1607,"Kab. Banyuasin, Sumatera Selatan",Jenjang Pendidikan SMP,16.1215
1608,"Kab. Ogan Komering Ulu Selatan, Sumatera Selatan",Jenjang Pendidikan SMP,16.8337
1609,"Kab. Ogan Komering Ulu Timur, Sumatera Selatan",Jenjang Pendidikan SMP,19.9764
1610,"Kab. Ogan Ilir, Sumatera Selatan",Jenjang Pendidikan SMP,18.5118
1611,"Kab. Empat Lawang, Sumatera Selatan",Jenjang Pendidikan SMP,30.9227
1612,"Kab. Penukal Abab Lematang Ilir, Sumatera Selatan",Jenjang Pendidikan SMP,8.7121
1613,"Kab. Musi Rawas Utara, Sumatera Selatan",Jenjang Pendidikan SMP,22.541
1671,"Kota Palembang, Sumatera Selatan",Jenjang Pendidikan SMP,7.526
1672,"Kota Prabumulih, Sumatera Selatan",Jenjang Pendidikan SMP,8.6262
1673,"Kota Pagar Alam, Sumatera Selatan",Jenjang Pendidikan SMP,9.7561
1674,"Kota Lubuk Linggau, Sumatera Selatan",Jenjang Pendidikan SMP,15.8974
1701,"Kab. Bengkulu Selatan, Bengkulu",Jenjang Pendidikan SMP,17.4603
1702,"Kab. Rejang Lebong, Bengkulu",Jenjang Pendidikan SMP,16.4063
1703,"Kab. Bengkulu Utara, Bengkulu",Jenjang Pendidikan SMP,17.1322
1704,"Kab. Kaur, Bengkulu",Jenjang Pendidikan SMP,10
1705,"Kab. Seluma, Bengkulu",Jenjang Pendidikan SMP,16.0221
1706,"Kab. Muko-muko, Bengkulu",Jenjang Pendidikan SMP,11.6022
1707,"Kab. Lebong, Bengkulu",Jenjang Pendidikan SMP,26.0204
1708,"Kab. Kepahiang, Bengkulu",Jenjang Pendidikan SMP,14.7541
1709,"Kab. Bengkulu Tengah, Bengkulu",Jenjang Pendidikan SMP,5.9361
1771,"Kota Bengkulu, Bengkulu",Jenjang Pendidikan SMP,16.1972
1801,"Kab. Lampung Barat, Lampung",Jenjang Pendidikan SMP,22.6374
1802,"Kab. Tanggamus, Lampung",Jenjang Pendidikan SMP,10.5341
1803,"Kab. Lampung Selatan, Lampung",Jenjang Pendidikan SMP,8.9686
1804,"Kab. Lampung Timur, Lampung",Jenjang Pendidikan SMP,10.951
1805,"Kab. Lampung Tengah, Lampung",Jenjang Pendidikan SMP,7.7717
1806,"Kab. Lampung Utara, Lampung",Jenjang Pendidikan SMP,18.2628
1807,"Kab. Way Kanan, Lampung",Jenjang Pendidikan SMP,24.2336
1808,"Kab. Tulang Bawang, Lampung",Jenjang Pendidikan SMP,12.9393
1809,"Kab. Pesawaran, Lampung",Jenjang Pendidikan SMP,15.009
1810,"Kab. Pringsewu, Lampung",Jenjang Pendidikan SMP,17.8744
1811,"Kab. Mesuji, Lampung",Jenjang Pendidikan SMP,20.2658
1812,"Kab. Tulang Bawang Barat, Lampung",Jenjang Pendidikan SMP,19.9546
1813,"Kab. Pesisir Barat, Lampung",Jenjang Pendidikan SMP,14.7368
1871,"Kota Bandar Lampung, Lampung",Jenjang Pendidikan SMP,3.5714
1872,"Kota Metro, Lampung",Jenjang Pendidikan SMP,7.0461
1901,"Kab. Bangka, Bangka Belitung",Jenjang Pendidikan SMP,2.6258
1902,"Kab. Belitung, Bangka Belitung",Jenjang Pendidikan SMP,7.6336
1903,"Kab. Bangka Barat, Bangka Belitung",Jenjang Pendidikan SMP,1.8868
1904,"Kab. Bangka Tengah, Bangka Belitung",Jenjang Pendidikan SMP,4.5082
1905,"Kab. Bangka Selatan, Bangka Belitung",Jenjang Pendidikan SMP,8.9404
1906,"Kab. Belitung Timur, Bangka Belitung",Jenjang Pendidikan SMP,1.9139
1971,"Kota Pangkalpinang, Bangka Belitung",Jenjang Pendidikan SMP,8.3333
2101,"Kab. Karimun, Kepulauan Riau",Jenjang Pendidikan SMP,4.5024
2102,"Kab. Bintan, Kepulauan Riau",Jenjang Pendidikan SMP,14.8699
2103,"Kab. Natuna, Kepulauan Riau",Jenjang Pendidikan SMP,4.3716
2104,"Kab. Lingga, Kepulauan Riau",Jenjang Pendidikan SMP,15.0289
2105,"Kab. Kepulauan Anambas, Kepulauan Riau",Jenjang Pendidikan SMP,0.7407
2171,"Kota Batam, Kepulauan Riau",Jenjang Pendidikan SMP,2.1834
2172,"Kota Tanjungpinang, Kepulauan Riau",Jenjang Pendidikan SMP,6.25
3101,"Kab. Kepulauan Seribu, D.K.I. Jakarta",Jenjang Pendidikan SMP,43.9024
3171,"Kota Jakarta Selatan, D.K.I. Jakarta",Jenjang Pendidikan SMP,2.903
3172,"Kota Jakarta Timur, D.K.I. Jakarta",Jenjang Pendidikan SMP,3.8273
3173,"Kota Jakarta Pusat, D.K.I. Jakarta",Jenjang Pendidikan SMP,3.8941
3174,"Kota Jakarta Barat, D.K.I. Jakarta",Jenjang Pendidikan SMP,3.1728
3175,"Kota Jakarta Utara, D.K.I. Jakarta",Jenjang Pendidikan SMP,1.9748
3201,"Kab. Bogor, Jawa Barat",Jenjang Pendidikan SMP,5.076
3202,"Kab. Sukabumi, Jawa Barat",Jenjang Pendidikan SMP,10.6163
3203,"Kab. Cianjur, Jawa Barat",Jenjang Pendidikan SMP,11.8644
3204,"Kab. Bandung, Jawa Barat",Jenjang Pendidikan SMP,7.9678
3205,"Kab. Garut, Jawa Barat",Jenjang Pendidikan SMP,6.9837
3206,"Kab. Tasikmalaya, Jawa Barat",Jenjang Pendidikan SMP,7.7957
3207,"Kab. Ciamis, Jawa Barat",Jenjang Pendidikan SMP,7.3246
3208,"Kab. Kuningan, Jawa Barat",Jenjang Pendidikan SMP,15.401
3209,"Kab. Cirebon, Jawa Barat",Jenjang Pendidikan SMP,13.3577
3210,"Kab. Majalengka, Jawa Barat",Jenjang Pendidikan SMP,6.8245
3211,"Kab. Sumedang, Jawa Barat",Jenjang Pendidikan SMP,8.1525
3212,"Kab. Indramayu, Jawa Barat",Jenjang Pendidikan SMP,11.9302
3213,"Kab. Subang, Jawa Barat",Jenjang Pendidikan SMP,16.3617
3214,"Kab. Purwakarta, Jawa Barat",Jenjang Pendidikan SMP,9.2271
3215,"Kab. Karawang, Jawa Barat",Jenjang Pendidikan SMP,12.294
3216,"Kab. Bekasi, Jawa Barat",Jenjang Pendidikan SMP,7.7181
3217,"Kab. Bandung Barat, Jawa Barat",Jenjang Pendidikan SMP,12.7841
3218,"Kab. Pangandaran, Jawa Barat",Jenjang Pendidikan SMP,13.8
3271,"Kota Bogor, Jawa Barat",Jenjang Pendidikan SMP,1.1073
3272,"Kota Sukabumi, Jawa Barat",Jenjang Pendidikan SMP,5.2838
3273,"Kota Bandung, Jawa Barat",Jenjang Pendidikan SMP,3.0635
3274,"Kota Cirebon, Jawa Barat",Jenjang Pendidikan SMP,2.381
3275,"Kota Bekasi, Jawa Barat",Jenjang Pendidikan SMP,2.4788
3276,"Kota Depok, Jawa Barat",Jenjang Pendidikan SMP,4.8304
3277,"Kota Cimahi, Jawa Barat",Jenjang Pendidikan SMP,1.3605
3278,"Kota Tasikmalaya, Jawa Barat",Jenjang Pendidikan SMP,5.7203
3301,"Kab. Cilacap, Jawa Tengah",Jenjang Pendidikan SMP,8.4241
3302,"Kab. Banyumas, Jawa Tengah",Jenjang Pendidikan SMP,9.7862
3303,"Kab. Purbalingga, Jawa Tengah",Jenjang Pendidikan SMP,2.8419
3304,"Kab. Banjarnegara, Jawa Tengah",Jenjang Pendidikan SMP,2.5394
3305,"Kab. Kebumen, Jawa Tengah",Jenjang Pendidikan SMP,2.7868
3306,"Kab. Purworejo, Jawa Tengah",Jenjang Pendidikan SMP,5.8206
3307,"Kab. Wonosobo, Jawa Tengah",Jenjang Pendidikan SMP,4.3238
3308,"Kab. Magelang, Jawa Tengah",Jenjang Pendidikan SMP,9.6112
3309,"Kab. Boyolali, Jawa Tengah",Jenjang Pendidikan SMP,6.2133
3310,"Kab. Klaten, Jawa Tengah",Jenjang Pendidikan SMP,3.5583
3311,"Kab. Sukoharjo, Jawa Tengah",Jenjang Pendidikan SMP,1.8536
3312,"Kab. Wonogiri, Jawa Tengah",Jenjang Pendidikan SMP,7.6923
3313,"Kab. Karanganyar, Jawa Tengah",Jenjang Pendidikan SMP,3.2432
3314,"Kab. Sragen, Jawa Tengah",Jenjang Pendidikan SMP,3.8929
3315,"Kab. Grobogan, Jawa Tengah",Jenjang Pendidikan SMP,9.6981
3316,"Kab. Blora, Jawa Tengah",Jenjang Pendidikan SMP,6.0662
3317,"Kab. Rembang, Jawa Tengah",Jenjang Pendidikan SMP,12.963
3318,"Kab. Pati, Jawa Tengah",Jenjang Pendidikan SMP,8.0592
3319,"Kab. Kudus, Jawa Tengah",Jenjang Pendidikan SMP,3.2895
3320,"Kab. Jepara, Jawa Tengah",Jenjang Pendidikan SMP,2.7426
3321,"Kab. Demak, Jawa Tengah",Jenjang Pendidikan SMP,10.2508
3322,"Kab. Semarang, Jawa Tengah",Jenjang Pendidikan SMP,3.2609
3323,"Kab. Temanggung, Jawa Tengah",Jenjang Pendidikan SMP,5.4085
3324,"Kab. Kendal, Jawa Tengah",Jenjang Pendidikan SMP,13.5954
3325,"Kab. Batang, Jawa Tengah",Jenjang Pendidikan SMP,4.8447
3326,"Kab. Pekalongan, Jawa Tengah",Jenjang Pendidikan SMP,8.8843
3327,"Kab. Pemalang, Jawa Tengah",Jenjang Pendidikan SMP,9.427
3328,"Kab. Tegal, Jawa Tengah",Jenjang Pendidikan SMP,3.2302
3329,"Kab. Brebes, Jawa Tengah",Jenjang Pendidikan SMP,5.6488
3371,"Kota Magelang, Jawa Tengah",Jenjang Pendidikan SMP,0
3372,"Kota Surakarta, Jawa Tengah",Jenjang Pendidikan SMP,4.2623
3373,"Kota Salatiga, Jawa Tengah",Jenjang Pendidikan SMP,2.0057
3374,"Kota Semarang, Jawa Tengah",Jenjang Pendidikan SMP,3.7463
3375,"Kota Pekalongan, Jawa Tengah",Jenjang Pendidikan SMP,3.7037
3376,"Kota Tegal, Jawa Tengah",Jenjang Pendidikan SMP,16.1224
3401,"Kab. Kulon Progo, D.I. Yogyakarta",Jenjang Pendidikan SMP,2.2581
3402,"Kab. Bantul, D.I. Yogyakarta",Jenjang Pendidikan SMP,3.4301
3403,"Kab. Gunung Kidul, D.I. Yogyakarta",Jenjang Pendidikan SMP,5
3404,"Kab. Sleman, D.I. Yogyakarta",Jenjang Pendidikan SMP,2.682
3471,"Kota Yogyakarta, D.I. Yogyakarta",Jenjang Pendidikan SMP,0
3501,"Kab. Pacitan, Jawa Timur",Jenjang Pendidikan SMP,3.1609
3502,"Kab. Ponorogo, Jawa Timur",Jenjang Pendidikan SMP,5.0147
3503,"Kab. Trenggalek, Jawa Timur",Jenjang Pendidikan SMP,7.5741
3504,"Kab. Tulungagung, Jawa Timur",Jenjang Pendidikan SMP,6.3953
3505,"Kab. Blitar, Jawa Timur",Jenjang Pendidikan SMP,9.329
3506,"Kab. Kediri, Jawa Timur",Jenjang Pendidikan SMP,7.8734
3507,"Kab. Malang, Jawa Timur",Jenjang Pendidikan SMP,7.4499
3508,"Kab. Lumajang, Jawa Timur",Jenjang Pendidikan SMP,4.5213
3509,"Kab. Jember, Jawa Timur",Jenjang Pendidikan SMP,9.0945
3510,"Kab. Banyuwangi, Jawa Timur",Jenjang Pendidikan SMP,5.7271
3511,"Kab. Bondowoso, Jawa Timur",Jenjang Pendidikan SMP,12.5172
3512,"Kab. Situbondo, Jawa Timur",Jenjang Pendidikan SMP,5.1534
3513,"Kab. Probolinggo, Jawa Timur",Jenjang Pendidikan SMP,7.9327
3514,"Kab. Pasuruan, Jawa Timur",Jenjang Pendidikan SMP,6.5771
3515,"Kab. Sidoarjo, Jawa Timur",Jenjang Pendidikan SMP,1.8429
3516,"Kab. Mojokerto, Jawa Timur",Jenjang Pendidikan SMP,11.4072
3517,"Kab. Jombang, Jawa Timur",Jenjang Pendidikan SMP,8.3333
3518,"Kab. Nganjuk, Jawa Timur",Jenjang Pendidikan SMP,11.5292
3519,"Kab. Madiun, Jawa Timur",Jenjang Pendidikan SMP,13.9535
3520,"Kab. Magetan, Jawa Timur",Jenjang Pendidikan SMP,8.607
3521,"Kab. Ngawi, Jawa Timur",Jenjang Pendidikan SMP,14.5308
3522,"Kab. Bojonegoro, Jawa Timur",Jenjang Pendidikan SMP,23.8699
3523,"Kab. Tuban, Jawa Timur",Jenjang Pendidikan SMP,10.2634
3524,"Kab. Lamongan, Jawa Timur",Jenjang Pendidikan SMP,15.1307
3525,"Kab. Gresik, Jawa Timur",Jenjang Pendidikan SMP,7.9325
3526,"Kab. Bangkalan, Jawa Timur",Jenjang Pendidikan SMP,16.2095
3527,"Kab. Sampang, Jawa Timur",Jenjang Pendidikan SMP,9.1792
3528,"Kab. Pamekasan, Jawa Timur",Jenjang Pendidikan SMP,14.6991
3529,"Kab. Sumenep, Jawa Timur",Jenjang Pendidikan SMP,13.3188
3571,"Kota Kediri, Jawa Timur",Jenjang Pendidikan SMP,5.1896
3572,"Kota Blitar, Jawa Timur",Jenjang Pendidikan SMP,0.625
3573,"Kota Malang, Jawa Timur",Jenjang Pendidikan SMP,0.1639
3574,"Kota Probolinggo, Jawa Timur",Jenjang Pendidikan SMP,2.2876
3575,"Kota Pasuruan, Jawa Timur",Jenjang Pendidikan SMP,4.9231
3576,"Kota Mojokerto, Jawa Timur",Jenjang Pendidikan SMP,1.6447
3577,"Kota Madiun, Jawa Timur",Jenjang Pendidikan SMP,0
3578,"Kota Surabaya, Jawa Timur",Jenjang Pendidikan SMP,1.0557
3579,"Kota Batu, Jawa Timur",Jenjang Pendidikan SMP,0.6803
3601,"Kab. Pandeglang, Banten",Jenjang Pendidikan SMP,10.1233
3602,"Kab. Lebak, Banten",Jenjang Pendidikan SMP,12.4153
3603,"Kab. Tangerang, Banten",Jenjang Pendidikan SMP,5.3011
3604,"Kab. Serang, Banten",Jenjang Pendidikan SMP,9.3629
3671,"Kota Tangerang, Banten",Jenjang Pendidikan SMP,2.4631
3672,"Kota Cilegon, Banten",Jenjang Pendidikan SMP,9.9602
3673,"Kota Serang, Banten",Jenjang Pendidikan SMP,3.3019
3674,"Kota Tangerang Selatan, Banten",Jenjang Pendidikan SMP,2.4915
5101,"Kab. Jembrana, Bali",Jenjang Pendidikan SMP,6.2176
5102,"Kab. Tabanan, Bali",Jenjang Pendidikan SMP,4.3406
5103,"Kab. Badung, Bali",Jenjang Pendidikan SMP,1.5235
5104,"Kab. Gianyar, Bali",Jenjang Pendidikan SMP,0.5155
5105,"Kab. Klungkung, Bali",Jenjang Pendidikan SMP,4.9296
5106,"Kab. Bangli, Bali",Jenjang Pendidikan SMP,0.9804
5107,"Kab. Karang Asem, Bali",Jenjang Pendidikan SMP,3.0411
5108,"Kab. Buleleng, Bali",Jenjang Pendidikan SMP,5.7878
5171,"Kota Denpasar, Bali",Jenjang Pendidikan SMP,2.181
5201,"Kab. Lombok Barat, Nusa Tenggara Barat",Jenjang Pendidikan SMP,6.694
5202,"Kab. Lombok Tengah, Nusa Tenggara Barat",Jenjang Pendidikan SMP,20.8983
5203,"Kab. Lombok Timur, Nusa Tenggara Barat",Jenjang Pendidikan SMP,11.7193
5204,"Kab. Sumbawa, Nusa Tenggara Barat",Jenjang Pendidikan SMP,16.2667
5205,"Kab. Dompu, Nusa Tenggara Barat",Jenjang Pendidikan SMP,22.6378
5206,"Kab. Bima, Nusa Tenggara Barat",Jenjang Pendidikan SMP,15.251
5207,"Kab. Sumbawa Barat, Nusa Tenggara Barat",Jenjang Pendidikan SMP,3.3195
5208,"Kab. Lombok Utara, Nusa Tenggara Barat",Jenjang Pendidikan SMP,2.1053
5271,"Kota Mataram, Nusa Tenggara Barat",Jenjang Pendidikan SMP,1.2442
5272,"Kota Bima, Nusa Tenggara Barat",Jenjang Pendidikan SMP,17.6955
5301,"Kab. Sumba Barat, Nusa Tenggara Timur",Jenjang Pendidikan SMP,19.469
5302,"Kab. Sumba Timur, Nusa Tenggara Timur",Jenjang Pendidikan SMP,5.6673
5303,"Kab. Kupang, Nusa Tenggara Timur",Jenjang Pendidikan SMP,15.7614
5304,"Kab. Timor Tengah Selatan, Nusa Tenggara Timur",Jenjang Pendidikan SMP,16.6192
5305,"Kab. Timor Tengah Utara, Nusa Tenggara Timur",Jenjang Pendidikan SMP,25.0366
5306,"Kab. Belu, Nusa Tenggara Timur",Jenjang Pendidikan SMP,9.188
5307,"Kab. Alor, Nusa Tenggara Timur",Jenjang Pendidikan SMP,13.0019
5308,"Kab. Lembata, Nusa Tenggara Timur",Jenjang Pendidikan SMP,21.8845
5309,"Kab. Flores Timur, Nusa Tenggara Timur",Jenjang Pendidikan SMP,16.2571
5310,"Kab. Sikka, Nusa Tenggara Timur",Jenjang Pendidikan SMP,16.2162
5311,"Kab. Ende, Nusa Tenggara Timur",Jenjang Pendidikan SMP,18.2946
5312,"Kab. Ngada, Nusa Tenggara Timur",Jenjang Pendidikan SMP,14.486
5313,"Kab. Manggarai, Nusa Tenggara Timur",Jenjang Pendidikan SMP,6.4516
5314,"Kab. Rote-Ndao, Nusa Tenggara Timur",Jenjang Pendidikan SMP,16.6667
5315,"Kab. Manggarai Barat, Nusa Tenggara Timur",Jenjang Pendidikan SMP,17.2775
5316,"Kab. Sumba Tengah, Nusa Tenggara Timur",Jenjang Pendidikan SMP,5.5319
5317,"Kab. Sumba Barat Daya, Nusa Tenggara Timur",Jenjang Pendidikan SMP,26.6242
5318,"Kab. Nagakeo, Nusa Tenggara Timur",Jenjang Pendidikan SMP,9.5361
5319,"Kab. Manggarai Timur, Nusa Tenggara Timur",Jenjang Pendidikan SMP,11.9266
5320,"Kab. Sabu Raijua, Nusa Tenggara Timur",Jenjang Pendidikan SMP,1.4423
5321,"Kab. Malaka, Nusa Tenggara Timur",Jenjang Pendidikan SMP,17.8571
5371,"Kota Kupang, Nusa Tenggara Timur",Jenjang Pendidikan SMP,9.6726
6101,"Kab. Sambas, Kalimantan Barat",Jenjang Pendidikan SMP,5.7692
6102,"Kab. Bengkayang, Kalimantan Barat",Jenjang Pendidikan SMP,20.5556
6103,"Kab. Landak, Kalimantan Barat",Jenjang Pendidikan SMP,9.1877
6104,"Kab. Mempawah, Kalimantan Barat",Jenjang Pendidikan SMP,4.2169
6105,"Kab. Sanggau, Kalimantan Barat",Jenjang Pendidikan SMP,10.6959
6106,"Kab. Ketapang, Kalimantan Barat",Jenjang Pendidikan SMP,14.119
6107,"Kab. Sintang, Kalimantan Barat",Jenjang Pendidikan SMP,9.0909
6108,"Kab. Kapuas Hulu, Kalimantan Barat",Jenjang Pendidikan SMP,7.8394
6109,"Kab. Sekadau, Kalimantan Barat",Jenjang Pendidikan SMP,9.6104
6110,"Kab. Melawi, Kalimantan Barat",Jenjang Pendidikan SMP,22.103
6111,"Kab. Kayong Utara, Kalimantan Barat",Jenjang Pendidikan SMP,1.6461
6112,"Kab. Kuburaya, Kalimantan Barat",Jenjang Pendidikan SMP,18.1265
6171,"Kota Pontianak, Kalimantan Barat",Jenjang Pendidikan SMP,9.358
6172,"Kota Singkawang, Kalimantan Barat",Jenjang Pendidikan SMP,9.7436
6201,"Kab. Kotawaringin Barat, Kalimantan Tengah",Jenjang Pendidikan SMP,5.9497
6202,"Kab. Kotawaringin Timur, Kalimantan Tengah",Jenjang Pendidikan SMP,12.098
6203,"Kab. Kapuas, Kalimantan Tengah",Jenjang Pendidikan SMP,14.7335
6204,"Kab. Barito Selatan, Kalimantan Tengah",Jenjang Pendidikan SMP,8.1505
6205,"Kab. Barito Utara, Kalimantan Tengah",Jenjang Pendidikan SMP,12.3188
6206,"Kab. Sukamara, Kalimantan Tengah",Jenjang Pendidikan SMP,12.6316
6207,"Kab. Lamandau, Kalimantan Tengah",Jenjang Pendidikan SMP,4.3689
6208,"Kab. Seruyan, Kalimantan Tengah",Jenjang Pendidikan SMP,2.6706
6209,"Kab. Katingan, Kalimantan Tengah",Jenjang Pendidikan SMP,4.3373
6210,"Kab. Pulang Pisau, Kalimantan Tengah",Jenjang Pendidikan SMP,8.2143
6211,"Kab. Gunung Mas, Kalimantan Tengah",Jenjang Pendidikan SMP,12.5767
6212,"Kab. Barito Timur, Kalimantan Tengah",Jenjang Pendidikan SMP,5.1887
6213,"Kab. Murung Raya, Kalimantan Tengah",Jenjang Pendidikan SMP,11.7021
6271,"Kota Palangka Raya, Kalimantan Tengah",Jenjang Pendidikan SMP,6.5375
6301,"Kab. Tanah Laut, Kalimantan Selatan",Jenjang Pendidikan SMP,4.8193
6302,"Kab. Kota Baru, Kalimantan Selatan",Jenjang Pendidikan SMP,6.639
6303,"Kota Banjar, Jawa Barat",Jenjang Pendidikan SMP,9.6516
6304,"Kab. Barito Kuala, Kalimantan Selatan",Jenjang Pendidikan SMP,3.7209
6305,"Kab. Tapin, Kalimantan Selatan",Jenjang Pendidikan SMP,3.8647
6306,"Kab. Hulu Sungai Selatan, Kalimantan Selatan",Jenjang Pendidikan SMP,5.8333
6307,"Kab. Hulu Sungai Tengah, Kalimantan Selatan",Jenjang Pendidikan SMP,6.4189
6308,"Kab. Hulu Sungai Utara, Kalimantan Selatan",Jenjang Pendidikan SMP,0.495
6309,"Kab. Tabalong, Kalimantan Selatan",Jenjang Pendidikan SMP,5.8667
6310,"Kab. Tanah Bumbu, Kalimantan Selatan",Jenjang Pendidikan SMP,8.3521
6311,"Kab. Balangan, Kalimantan Selatan",Jenjang Pendidikan SMP,2.5974
6371,"Kota Banjarmasin, Kalimantan Selatan",Jenjang Pendidikan SMP,3.7757
6372,"Kota Banjarbaru, Kalimantan Selatan",Jenjang Pendidikan SMP,0.6098
6401,"Kab. Paser, Kalimantan Timur",Jenjang Pendidikan SMP,3.8217
6402,"Kab. Kutai Barat, Kalimantan Timur",Jenjang Pendidikan SMP,2.0588
6403,"Kab. Kutai Kartanegara, Kalimantan Timur",Jenjang Pendidikan SMP,5.7493
6404,"Kab. Kutai Timur, Kalimantan Timur",Jenjang Pendidikan SMP,3.4109
6405,"Kab. Berau, Kalimantan Timur",Jenjang Pendidikan SMP,0.4854
6409,"Kab. Penajam Paser Utara, Kalimantan Timur",Jenjang Pendidikan SMP,0
6411,"Kab. Mahakam Ulu, Kalimantan Timur",Jenjang Pendidikan SMP,13.5135
6471,"Kota Balikpapan, Kalimantan Timur",Jenjang Pendidikan SMP,2.0619
6472,"Kota Samarinda, Kalimantan Timur",Jenjang Pendidikan SMP,5.8659
6474,"Kota Bontang, Kalimantan Timur",Jenjang Pendidikan SMP,3.6304
6501,"Kab. Malinau, Kalimantan Utara",Jenjang Pendidikan SMP,5.8824
6502,"Kab. Bulungan, Kalimantan Utara",Jenjang Pendidikan SMP,14.1844
6503,"Kab. Tana Tidung, Kalimantan Utara",Jenjang Pendidikan SMP,0
6504,"Kab. Nunukan, Kalimantan Utara",Jenjang Pendidikan SMP,4.3624
6571,"Kota Tarakan, Kalimantan Utara",Jenjang Pendidikan SMP,0.6993
7101,"Kab. Bolaang Mongondow, Sulawesi Utara",Jenjang Pendidikan SMP,15.5452
7102,"Kab. Minahasa, Sulawesi Utara",Jenjang Pendidikan SMP,15.859
7103,"Kab. Kep. Sangihe, Sulawesi Utara",Jenjang Pendidikan SMP,16.7722
7104,"Kab. Kepulauan Talaud, Sulawesi Utara",Jenjang Pendidikan SMP,14.4531
7105,"Kab. Minahasa Selatan, Sulawesi Utara",Jenjang Pendidikan SMP,13
7106,"Kab. Minahasa Utara, Sulawesi Utara",Jenjang Pendidikan SMP,13.3501
7107,"Kab. Bolaang Mongondow Utara, Sulawesi Utara",Jenjang Pendidikan SMP,4.9689
7108,"Kab. Kepulauan Sitaro, Sulawesi Utara",Jenjang Pendidikan SMP,15.2866
7109,"Kab. Minahasa Tenggara, Sulawesi Utara",Jenjang Pendidikan SMP,7.5472
7110,"Kab. Bolaang Mongondow Selatan, Sulawesi Utara",Jenjang Pendidikan SMP,9.375
7111,"Kab. Bolaang Mongondow Timur, Sulawesi Utara",Jenjang Pendidikan SMP,19.0083
7171,"Kota Manado, Sulawesi Utara",Jenjang Pendidikan SMP,2.7851
